{
  "field": "bn254",
  "width": 3,
  "name": "bn254-shared-sum",
  "instructions": [
    { "op": "add", "a": 0, "b": 1 },
    { "op": "add", "a": 3, "b": 2 },
    { "op": "add", "a": 4, "b": 0 },
    { "op": "add", "a": 4, "b": 1 },
    { "op": "add", "a": 4, "b": 2 }
  ],
  "outputs": [5, 6, 7]
}
