{
  "field": "gf256",
  "width": 4,
  "name": "aes-shared-sum",
  "instructions": [
    { "op": "add", "a": 0, "b": 1 },
    { "op": "add", "a": 4, "b": 2 },
    { "op": "add", "a": 5, "b": 3 },
    { "op": "add", "a": 0, "b": 1 },
    { "op": "mul", "k": "02", "a": 7 },
    { "op": "add", "a": 0, "b": 8 },
    { "op": "add", "a": 9, "b": 6 },
    { "op": "add", "a": 1, "b": 2 },
    { "op": "mul", "k": "02", "a": 11 },
    { "op": "add", "a": 1, "b": 12 },
    { "op": "add", "a": 13, "b": 6 },
    { "op": "add", "a": 2, "b": 3 },
    { "op": "mul", "k": "02", "a": 15 },
    { "op": "add", "a": 2, "b": 16 },
    { "op": "add", "a": 17, "b": 6 },
    { "op": "add", "a": 3, "b": 0 },
    { "op": "mul", "k": "02", "a": 19 },
    { "op": "add", "a": 3, "b": 20 },
    { "op": "add", "a": 21, "b": 6 }
  ],
  "outputs": [10, 14, 18, 22]
}
